<?xml version="1.0"?>
<Flower xmlns:xsi="http://www.w3.org/2001/XMLSchema-instance"
        xsi:noNamespaceSchemaLocation="Flower.xsd">
    <name>Roze</name>
    <soil>PODZOLIC</soil>
    <origin>Ukraine</origin>
    <visualParameters>
        <stem_color>#FF0000</stem_color>
        <leaf_color>#00FFFF</leaf_color>
        <size>MIDDLE</size>
    </visualParameters>
    <growingTips>
        <temperature>15</temperature>
        <is_photophilous>true</is_photophilous>
        <Watering>10</Watering>
    </growingTips>
    <multiplying>BY_CUTTINGS</multiplying>
</Flower>